{
  "episode_id": "EP01_Iran",
  "act_id": "HỒI I",
  "cluster_id": "cum_01_Hoi_I",
  "cluster_type": "HOI_PHAN_TICH",
  "author_visual_note": "Hai bức ảnh chụp cùng một góc phố Tehran đặt cạnh nhau | Cảnh sát đạo đức tuần tra, xen lẫn hình ảnh giới trẻ Iran hiện đại | Bản đồ địa chính trị Trung Đông thu phóng vào vị trí của Iran và các mỏ dầu",
  "bgm_track": "bgm_tense_history.wav",
  "total_duration_sec": 102.786735,
  "beats": [
    {
      "beat_id": "beat_01",
      "segment_id": "1.1",
      "author_visual_note": "Hai bức ảnh chụp cùng một góc phố Tehran đặt cạnh nhau",
      "wav_file": "beats_wav/beat_01.wav",
      "source_mp3_t0": 0.0,
      "source_mp3_t1": 2.032,
      "t0": 0.0,
      "t1": 2.031746,
      "duration": 2.031746,
      "narration_text": "Hãy nhìn vào hai bức ảnh này.",
      "lighting_mode": "DAYLIGHT_WARM",
      "scene_template": "T01_Split_World_Contrast",
      "hud_banner": {
        "text": "Hãy nhìn vào 2 bức ảnh này...",
        "style": "FRAMELESS_TYPEWRITER",
        "y_center": 118,
        "render_pass": "PASS_2_POST_CAMERA"
      },
      "camera": {
        "zoom_start": 1.0,
        "zoom_end": 1.05,
        "pan_x_start": 0,
        "pan_x_end": 0,
        "viewport_isolation_mode": false
      },
      "characters": [
        { "role": "char_ziro_host", "x": 210, "y": 725, "scale": 1.02, "emotion": "explaining", "neck_insert_px": 35 }
      ],
      "sub_triggers_bt": [
        { "bt": 0.25, "action_type": "MYSTERY_FRAMES_2", "label": "?" }
      ],
      "sfx_events": [
        { "bt": 0.25, "sfx_file": "whoosh_transition.wav", "gain_db": -6.0 }
      ]
    },
    {
      "beat_id": "beat_02",
      "segment_id": "1.1",
      "author_visual_note": "Hai bức ảnh chụp cùng một góc phố Tehran đặt cạnh nhau",
      "wav_file": "beats_wav/beat_02.wav",
      "source_mp3_t0": 2.032,
      "source_mp3_t1": 12.237,
      "t0": 2.031746,
      "t1": 12.236961,
      "duration": 10.205215,
      "narration_text": "Bên trái: Phụ nữ mặc váy ngắn, tóc xõa ngang vai, bước đi dưới nắng vàng giữa những rạp chiếu phim và quán cà phê mở. Trông giống như Paris hay Los Angeles.",
      "lighting_mode": "DAYLIGHT_WARM",
      "scene_template": "T04_Empire_Parade",
      "hud_banner": {
        "text": "BÊN TRÁI: TEHRAN THẬP NIÊN 1970",
        "style": "FRAMELESS_TYPEWRITER",
        "y_center": 118,
        "render_pass": "PASS_2_POST_CAMERA"
      },
      "camera": {
        "zoom_start": 1.0,
        "zoom_end": 1.06,
        "pan_x_start": -40,
        "pan_x_end": 20,
        "viewport_isolation_mode": false
      },
      "characters": [
        { "role": "char_ziro_host", "x": 205, "y": 725, "scale": 1.0, "emotion": "explaining", "neck_insert_px": 35 }
      ],
      "sub_triggers_bt": [
        {
          "bt": 0.45,
          "action_type": "PHOTO_CARD_LEFT",
          "label": "Tehran, 1970",
          "sub_label": "\"Váy ngắn • Tóc xõa • Nắng vàng\"",
          "photo_file": "cum_01_Hoi_I/01_beat02_0007s-0018s_tehran_1970_shops.jpg"
        },
        {
          "bt": 3.80,
          "action_type": "PHOTO_CARD_TOP_RIGHT",
          "label": "Đại lộ Tehran, 1970",
          "sub_label": "",
          "photo_file": "cum_01_Hoi_I/02_beat02_0010s-0018s_tehran_1970_boulevard.jpg"
        },
        {
          "bt": 5.30,
          "action_type": "CINEMA_CAFE_PILLS",
          "label": "Rạp chiếu phim",
          "sub_label": "Quán cà phê mở"
        },
        {
          "bt": 7.90,
          "action_type": "PARIS_LA_STAMPS",
          "label": "✓ Giống Paris?",
          "sub_label": "✓ Hay Los Angeles?"
        }
      ],
      "sfx_events": [
        { "bt": 0.45, "sfx_file": "pop_card.wav", "gain_db": -6.0 },
        { "bt": 3.80, "sfx_file": "pop_card.wav", "gain_db": -6.0 },
        { "bt": 7.90, "sfx_file": "stamp_slam.wav", "gain_db": -6.0 }
      ]
    },
    {
      "beat_id": "beat_03",
      "segment_id": "1.1",
      "author_visual_note": "Hai bức ảnh chụp cùng một góc phố Tehran đặt cạnh nhau",
      "wav_file": "beats_wav/beat_03.wav",
      "source_mp3_t0": 12.237,
      "source_mp3_t1": 22.127,
      "t0": 12.236961,
      "t1": 22.127029,
      "duration": 9.890068,
      "narration_text": "Bên phải: Một biển đen kịt những tấm vải trùm kín từ đầu đến chân. Trên bức tường phía sau là dòng chữ cao bằng tòa nhà năm tầng: \"Cái chết cho nước Mỹ\".",
      "lighting_mode": "DAYLIGHT_WARM",
      "scene_template": "T01_Split_World_Contrast",
      "hud_banner": {
        "text": "BÊN PHẢI: TEHRAN THẬP NIÊN 1980",
        "style": "FRAMELESS_TYPEWRITER",
        "y_center": 118,
        "render_pass": "PASS_2_POST_CAMERA"
      },
      "camera": {
        "zoom_start": 1.0,
        "zoom_end": 1.10,
        "pan_x_start": 0,
        "pan_x_end": 65,
        "viewport_isolation_mode": true
      },
      "characters": [
        { "role": "char_ziro_host", "x": 205, "y": 725, "scale": 1.0, "emotion": "shocked", "neck_insert_px": 35 }
      ],
      "sub_triggers_bt": [
        {
          "bt": 0.0,
          "action_type": "PHOTO_CARD_LEFT",
          "label": "Tehran, 1970",
          "sub_label": "\"Paris phương Đông?\"",
          "photo_file": "cum_01_Hoi_I/01_beat02_0007s-0018s_tehran_1970_shops.jpg"
        },
        {
          "bt": 0.35,
          "action_type": "PHOTO_CARD_RIGHT",
          "label": "Tehran, 1980",
          "sub_label": "\"Biển đen kịt trùm kín từ đầu đến chân\"",
          "photo_file": "cum_01_Hoi_I/04_beat03_0018s-0028s_tehran_1980_revolution.jpg"
        },
        {
          "bt": 2.50,
          "action_type": "CHADOR_ROW_5",
          "label": "5_CHADOR_ICONS"
        },
        {
          "bt": 6.10,
          "action_type": "BUILDING_5_FLOORS",
          "label": "CAO 5 TẦNG!"
        },
        {
          "bt": 7.95,
          "action_type": "STAMP_SLAM_RIGHT",
          "label": "\"CÁI CHẾT CHO NƯỚC MỸ!\""
        }
      ],
      "sfx_events": [
        { "bt": 0.35, "sfx_file": "whoosh_transition.wav", "gain_db": -6.0 },
        { "bt": 7.95, "sfx_file": "stamp_slam.wav", "gain_db": -5.5 }
      ]
    },
    {
      "beat_id": "beat_04",
      "segment_id": "1.1",
      "author_visual_note": "Hai bức ảnh chụp cùng một góc phố Tehran đặt cạnh nhau",
      "wav_file": "beats_wav/beat_04.wav",
      "source_mp3_t0": 22.127,
      "source_mp3_t1": 32.292,
      "t0": 22.127029,
      "t1": 32.292018,
      "duration": 10.164989,
      "narration_text": "Hai bức ảnh này không phải được chụp ở hai hành tinh khác nhau. Chúng được chụp tại cùng một con phố ở thủ đô Tehran, cách nhau đúng 10 năm. Đất nước đó là Iran.",
      "lighting_mode": "DAYLIGHT_WARM",
      "scene_template": "T08_Fact_vs_Myth_Strike",
      "hud_banner": {
        "text": "Chụp ở 2 hành tinh khác nhau?",
        "style": "FRAMELESS_TYPEWRITER",
        "y_center": 118,
        "render_pass": "PASS_2_POST_CAMERA"
      },
      "camera": {
        "zoom_start": 1.0,
        "zoom_end": 1.14,
        "pan_x_start": 0,
        "pan_x_end": 0,
        "viewport_isolation_mode": false
      },
      "characters": [
        { "role": "char_ziro_host", "x": 215, "y": 735, "scale": 1.02, "emotion": "explaining", "neck_insert_px": 35 }
      ],
      "sub_triggers_bt": [
        {
          "bt": 0.25,
          "action_type": "TWO_PLANETS_MYTH",
          "label": "KHÔNG PHẢI 2 HÀNH TINH!"
        },
        {
          "bt": 3.90,
          "action_type": "SATELLITE_TEHRAN_REVEAL",
          "label": "CÙNG 1 CON PHỐ • CÁCH NHAU 10 NĂM!",
          "sub_label": "I R A N",
          "photo_file": "cum_01_Hoi_I/07_beat04_0028s-0034s_satellite_iran_middle_east.jpg"
        }
      ],
      "sfx_events": [
        { "bt": 1.50, "sfx_file": "pop_card.wav", "gain_db": -6.0 },
        { "bt": 3.90, "sfx_file": "whoosh_transition.wav", "gain_db": -5.5 }
      ]
    },
    {
      "beat_id": "beat_05",
      "segment_id": "1.2",
      "author_visual_note": "Cảnh sát đạo đức tuần tra, xen lẫn hình ảnh giới trẻ Iran hiện đại",
      "wav_file": "beats_wav/beat_05.wav",
      "source_mp3_t0": 32.292,
      "source_mp3_t1": 35.707,
      "t0": 32.292018,
      "t1": 35.706984,
      "duration": 3.414966,
      "narration_text": "Và đây là điều khiến nơi này trở nên cực kỳ kỳ lạ.",
      "lighting_mode": "DAYLIGHT_WARM",
      "scene_template": "T05_Data_Chart_Scale",
      "hud_banner": {
        "text": "Và đây là điều khiến nơi này trở nên...",
        "style": "FRAMELESS_TYPEWRITER",
        "y_center": 118,
        "render_pass": "PASS_2_POST_CAMERA"
      },
      "camera": {
        "zoom_start": 1.0,
        "zoom_end": 1.08,
        "pan_x_start": 0,
        "pan_x_end": 0,
        "viewport_isolation_mode": false
      },
      "characters": [
        { "role": "char_ziro_host", "x": 960, "y": 720, "scale": 1.18, "emotion": "shocked", "neck_insert_px": 35 }
      ],
      "sub_triggers_bt": [
        { "bt": 2.10, "action_type": "PARADOX_QUESTION_BURST", "label": "CỰC KỲ KỲ LẠ!" }
      ],
      "sfx_events": [
        { "bt": 2.10, "sfx_file": "stamp_slam.wav", "gain_db": -6.0 }
      ]
    },
    {
      "beat_id": "beat_06",
      "segment_id": "1.2",
      "author_visual_note": "Cảnh sát đạo đức tuần tra, xen lẫn hình ảnh giới trẻ Iran hiện đại",
      "wav_file": "beats_wav/beat_06.wav",
      "source_mp3_t0": 35.707,
      "source_mp3_t1": 47.382,
      "t0": 35.706984,
      "t1": 47.382018,
      "duration": 11.675034,
      "narration_text": "Iran là một quốc gia mà phần lớn dân số dưới 35 tuổi, có học thức cao và lướt Instagram nhiều bậc nhất thế giới. Nhưng họ lại bị cai trị bởi một hội đồng những giáo sĩ già mặc áo choàng từ thế kỷ thứ 7.",
      "lighting_mode": "DAYLIGHT_WARM",
      "scene_template": "T01_Split_World_Contrast",
      "hud_banner": {
        "text": "Nghịch lý Iran: Giới trẻ hiện đại vs Giáo sĩ thế kỷ thứ 7",
        "style": "FRAMELESS_TYPEWRITER",
        "y_center": 116,
        "render_pass": "PASS_2_POST_CAMERA"
      },